<?xml version="1.0" encoding="UTF-8"?>
<mappings xmlns="http://www.garfield.com/MappingSchema"
	xmlns:xsi="http://www.w3.org/2001/XMLSchema-instance"
	xsi:schemaLocation="http://www.garfield.com/MappingSchema MappingSchema.xsd ">
	<!-- configure equipment ont interface -->
	<mapping>
		<attributes>
			<prefix>configure equipment ont</prefix>
			<miniAttributes>1</miniAttributes>
			<attribute>
				<cliname>interface</cliname>
				<dbTable>ontConfig</dbTable>
				<dbAttribute>index</dbAttribute>
				<index>index(regx:1/1/:(16,8,-2)(7,9,1)(0,7,1))</index>
				<!--index>index1(regx:1/1/:(16,8,-2)(7,9,1)(0,7,1));index2(1)</index -->
				<parser>regx:1/1/:(16,8,-2)(7,9,1)(0,7,1)</parser>
			</attribute>
			<attribute>
				<cliname>sw-ver-pland</cliname>
				<dbTable>ontConfig</dbTable>
				<dbAttribute>planSw</dbAttribute>
				<index>index(regx:1/1/:(16,8,-2)(7,9,1)(0,7,1))</index>
			</attribute>
			<attribute>
				<cliname>battery-bkup</cliname>
				<dbTable>ontConfig</dbTable>
				<dbAttribute>batBkup</dbAttribute>
				<index>index(regx:1/1/:(16,8,-2)(7,9,1)(0,7,1))</index>
				<parser>enum:(0x0,disable)(0x1,enable)</parser>
				<default>disable</default>
			</attribute>
			<attribute>
				<cliname>berint</cliname>
				<dbTable>ontConfig</dbTable>
				<dbAttribute>berItv</dbAttribute>
				<index>index(regx:1/1/:(16,8,-2)(7,9,1)(0,7,1))</index>
				<default>8000</default>
			</attribute>
			<attribute>
				<cliname>desc1</cliname>
				<dbTable>ontConfig</dbTable>
				<dbAttribute>subDat1</dbAttribute>
				<index>index(regx:1/1/:(16,8,-2)(7,9,1)(0,7,1))</index>
			</attribute>
			<attribute>
				<cliname>desc2</cliname>
				<dbTable>ontConfig</dbTable>
				<dbAttribute>subDat2</dbAttribute>
				<index>index(regx:1/1/:(16,8,-2)(7,9,1)(0,7,1))</index>
			</attribute>
			<attribute>
				<cliname>provversion</cliname>
				<dbTable>ontConfig</dbTable>
				<dbAttribute>provVer</dbAttribute>
				<index>index(regx:1/1/:(16,8,-2)(7,9,1)(0,7,1))</index>
				<default>*</default>
			</attribute>
			<attribute>
				<cliname>sernum</cliname>
				<dbTable>ontConfig</dbTable>
				<dbAttribute>serNum</dbAttribute>
				<index>index(regx:1/1/:(16,8,-2)(7,9,1)(0,7,1))</index>
				<parser>class:com.mars.dbexport.service.parse.OntSnParser</parser>
				<default>ALCL:00000000</default>
			</attribute>
			<attribute>
				<cliname>subslocid</cliname>
				<dbTable>ontConfig</dbTable>
				<dbAttribute>slid</dbAttribute>
				<index>index(regx:1/1/:(16,8,-2)(7,9,1)(0,7,1))</index>
				<default>WILDCARD</default>
			</attribute>
			<attribute>
				<cliname>fec-up</cliname>
				<dbTable>ontConfig</dbTable>
				<dbAttribute>fecUp</dbAttribute>
				<index>index(regx:1/1/:(16,8,-2)(7,9,1)(0,7,1))</index>
				<parser>enum:(0x0,disable)(0x1,enable)</parser>
				<default>disable</default>
			</attribute>
			<attribute>
				<cliname>bridge-map-mode</cliname>
				<dbTable>ontConfig</dbTable>
				<dbAttribute>brMapMd</dbAttribute>
				<index>index(regx:1/1/:(16,8,-2)(7,9,1)(0,7,1))</index>
				<parser>enum:(0x5,1-mp-bridge-map-filter)(0x7,n-mp-bridge-map-filter)</parser>
				<default>1-mp-bridge-map-filter</default>
			</attribute>
			<attribute>
				<cliname>pwr-shed-prof-id</cliname>
				<dbTable>ontConfig</dbTable>
				<dbAttribute>pwrShed</dbAttribute>
				<index>index(regx:1/1/:(16,8,-2)(7,9,1)(0,7,1))</index>
				<parser>auto:(0x0,none)</parser>
				<default>none</default>
			</attribute>
			<attribute>
				<cliname>ont-enable</cliname>
				<dbTable>ontConfig</dbTable>
				<dbAttribute>OntEnDi</dbAttribute>
				<index>index(regx:1/1/:(16,8,-2)(7,9,1)(0,7,1))</index>
				<parser>enum:(0x0,auto)(0x1,disable)(0x2,enable)</parser>
				<default>auto</default>
			</attribute>
			<attribute>
				<cliname>p2p-enable</cliname>
				<dbTable>ontConfig</dbTable>
				<dbAttribute>eptpEn</dbAttribute>
				<index>index(regx:1/1/:(16,8,-2)(7,9,1)(0,7,1))</index>
				<parser>enum:(0x0,disable)(0x1,enable)</parser>
				<default>disable</default>
			</attribute>
			<attribute>
				<cliname>sw-dnload-version</cliname>
				<dbTable>ontConfig</dbTable>
				<dbAttribute>dldSw</dbAttribute>
				<index>index(regx:1/1/:(16,8,-2)(7,9,1)(0,7,1))</index>
				<default>DISABLED</default>
			</attribute>
			<attribute>
				<cliname>plnd-var</cliname>
				<dbTable>ontConfig</dbTable>
				<dbAttribute>plVar</dbAttribute>
				<index>index(regx:1/1/:(16,8,-2)(7,9,1)(0,7,1))</index>
				<default></default>
			</attribute>
			<attribute>
				<cliname>rf-filter</cliname>
				<dbTable>ontConfig</dbTable>
				<dbAttribute>ontVdRF</dbAttribute>
				<index>index(regx:1/1/:(16,8,-2)(7,9,1)(0,7,1))</index>
				<parser>enum:(0x0,pass-none)(0x1,pass-low)(0x2,pass-low-high)</parser>
				<default>pass-low-high</default>
			</attribute>
			<attribute>
				<cliname>us-police-mode</cliname>
				<dbTable>ontConfig</dbTable>
				<dbAttribute>usPolic</dbAttribute>
				<index>index(regx:1/1/:(16,8,-2)(7,9,1)(0,7,1))</index>
				<parser>enum:(0x0,local)(0x1,network)</parser>
				<default>local</default>
			</attribute>
			<attribute>
				<cliname>enable-aes</cliname>
				<dbTable>ontConfig</dbTable>
				<dbAttribute>aesEnbl</dbAttribute>
				<index>index(regx:1/1/:(16,8,-2)(7,9,1)(0,7,1))</index>
				<parser>enum:(0x0,disable)(0x1,enable)</parser>
				<default>disable</default>
			</attribute>
			<attribute>
				<cliname>voip-allowed</cliname>
				<dbTable>ontConfig</dbTable>
				<dbAttribute>voipCap</dbAttribute>
				<index>index(regx:1/1/:(16,8,-2)(7,9,1)(0,7,1))</index>
				<parser>enum:(0x0,disable)(0x1,enable)(0x2,iphost)(0x3,veip)</parser>
				<default>disable</default>
			</attribute>
			<attribute>
				<cliname>iphc-allowed</cliname>
				<dbTable>ontConfig</dbTable>
				<dbAttribute>iphcMd</dbAttribute>
				<index>index(regx:1/1/:(16,8,-2)(7,9,1)(0,7,1))</index>
				<parser>enum:(0x0,disable)(0x1,enable)</parser>
				<default>disable</default>
			</attribute>
			<attribute>
				<cliname>log-auth-id</cliname>
				<dbTable>ontConfig</dbTable>
				<dbAttribute>authID</dbAttribute>
				<index>index(regx:1/1/:(16,8,-2)(7,9,1)(0,7,1))</index>
				<default></default>
			</attribute>
			<attribute>
				<cliname>log-auth-pwd</cliname>
				<dbTable>ontConfig</dbTable>
				<dbAttribute>authPw</dbAttribute>
				<index>index(regx:1/1/:(16,8,-2)(7,9,1)(0,7,1))</index>
				<default></default>
			</attribute>
			<attribute>
				<cliname>cvlantrans-mode</cliname>
				<dbTable>ontConfig</dbTable>
				<dbAttribute>xcvmode</dbAttribute>
				<index>index(regx:1/1/:(16,8,-2)(7,9,1)(0,7,1))</index>
				<parser>enum:(0x0,remote)(0x1,local)</parser>
				<default>remote</default>
			</attribute>
		</attributes>
	</mapping>

	<mapping>
		<attributes>
			<prefix>configure equipment ont</prefix>
			<miniAttributes>2</miniAttributes>
			<attribute>
				<cliname>interface</cliname>
				<dbTable>ontConfig</dbTable>
				<dbAttribute>index</dbAttribute>
				<index>index(regx:1/1/:(16,8,-2)(7,9,1)(0,7,1))</index>
				<parser>regx:1/1/:(16,8,-2)(7,9,1)(0,7,1)</parser>
			</attribute>
			<attribute>
				<cliname>slid-visibility</cliname>
				<dbTable>ontConfig</dbTable>
				<dbAttribute>slidAvl</dbAttribute>
				<index>index(regx:1/1/:(16,8,-2)(7,9,1)(0,7,1))</index>
				<parser>enum:(0x0,disabled)(0x1,enabled-slid-on)(0x2,enabled-all)</parser>
				<default>disabled</default>
			</attribute>
			<attribute>
				<cliname>admin-state</cliname>
				<dbTable>ontConfig</dbTable>
				<dbAttribute>admin</dbAttribute>
				<index>index(regx:1/1/:(16,8,-2)(7,9,1)(0,7,1))</index>
				<parser>enum:(0x1,up)(0x2,down)</parser>
				<default>down</default>
			</attribute>
		</attributes>
	</mapping>

	<mapping>
		<attributes>
			<prefix>configure equipment ont</prefix>
			<miniAttributes>3</miniAttributes>
			<attribute>
				<cliname>interface</cliname>
				<dbTable>ontConfig</dbTable>
				<dbAttribute>index</dbAttribute>
				<index>index(regx:1/1/:(16,8,-2)(7,9,1)(0,7,1))</index>
				<parser>regx:1/1/:(16,8,-2)(7,9,1)(0,7,1)</parser>
			</attribute>
			<attribute>
				<cliname>ethernet</cliname>
				<dbTable>ontConfig</dbTable>
				<dbAttribute>null</dbAttribute>
				<index>index(regx:1/1/:(16,8,-2)(7,9,1)(0,7,1))</index>
				<parser>bool:</parser>
				<novalue>true</novalue>
			</attribute>
			<attribute>
				<cliname>ont-pm-collect</cliname>
				<dbTable>ontConfig</dbTable>
				<dbAttribute>ethPmEn</dbAttribute>
				<index>index(regx:1/1/:(16,8,-2)(7,9,1)(0,7,1))</index>
				<parser>enum:(0x1,enable)(0x2,disable)</parser>
				<default>disable</default>
			</attribute>
		</attributes>
	</mapping>
</mappings>
